{
  "device": {
    "id": "dev_factory_alpha",
    "organizationId": "org_alpha",
    "ownershipState": "claimed",
    "name": "Shcare Clinic Unit 01",
    "type": "stethoscope",
    "status": "connected",
    "connected": true,
    "online": true,
    "updatedAt": "2026-08-15T04:10:01.000Z",
    "credentialRotation": {
      "protocolVersion": 1,
      "id": "rotation_alpha_001",
      "state": "pending_device_ack",
      "commandId": "cmd_rotation_alpha_001",
      "requestedAt": "2026-08-15T04:10:00.000Z",
      "expiresAt": "2026-08-15T04:20:00.000Z",
      "acknowledgedAt": "",
      "confirmingAt": "",
      "confirmedAt": "",
      "expiredAt": "",
      "rolledBackAt": "",
      "failedAt": "",
      "failureCode": "",
      "confirmed": false
    }
  },
  "rotation": {
    "protocolVersion": 1,
    "id": "rotation_alpha_001",
    "state": "pending_device_ack",
    "commandId": "cmd_rotation_alpha_001",
    "requestedAt": "2026-08-15T04:10:00.000Z",
    "expiresAt": "2026-08-15T04:20:00.000Z",
    "acknowledgedAt": "",
    "confirmingAt": "",
    "confirmedAt": "",
    "expiredAt": "",
    "rolledBackAt": "",
    "failedAt": "",
    "failureCode": "",
    "confirmed": false
  },
  "command": {
    "protocolVersion": 1,
    "id": "cmd_rotation_alpha_001",
    "deviceId": "dev_factory_alpha",
    "organizationId": "org_alpha",
    "type": "device.rotate_secret",
    "correlationId": "rotation_alpha_001",
    "state": "delivered",
    "status": "delivered",
    "code": "TRANSPORT_DELIVERED",
    "detail": "Command delivered to an authenticated transport",
    "requestedByUserId": "usr_platform_admin",
    "issuedAt": "2026-08-15T04:10:00.000Z",
    "expiresAt": "2026-08-15T04:20:00.000Z",
    "acceptedAt": "2026-08-15T04:10:00.000Z",
    "queuedAt": "",
    "deliveredAt": "2026-08-15T04:10:01.000Z",
    "acknowledgedAt": "",
    "applyingAt": "",
    "appliedAt": "",
    "failedAt": "",
    "expiredAt": "",
    "delivery": {
      "websocket": true,
      "mqtt": false,
      "delivered": true
    },
    "createdAt": "2026-08-15T04:10:00.000Z",
    "updatedAt": "2026-08-15T04:10:01.000Z"
  },
  "confirmed": false
}
